{
  "$schema": "https://json-schema.org/draft/2020-12/schema",
  "$id": "https://taipanbox.dev/agent-passport/v0.1/agent-passport.schema.json",
  "title": "Agent Passport",
  "description": "A small JSON document describing one agent's identity. See SPEC.md §4.",
  "type": "object",
  "required": ["schema", "id", "owner"],
  "properties": {
    "schema": {
      "type": "string",
      "const": "taipanbox.dev/agent-passport/v0.1",
      "description": "Schema identifier and version."
    },
    "id": {
      "type": "string",
      "description": "Canonical agent identifier. See SPEC.md §3.1.",
      "pattern": "^agent://[a-z0-9.-]+/[a-z0-9._/-]+$",
      "maxLength": 255
    },
    "display_name": {
      "type": "string",
      "description": "Human-readable name for display purposes."
    },
    "owner": {
      "type": "string",
      "description": "Human or team principal (email or group). See SPEC.md §4.1.",
      "minLength": 1
    },
    "runtime": {
      "type": "string",
      "description": "Free-form label for the agent runtime/framework (e.g. langgraph)."
    },
    "parent": {
      "type": "string",
      "description": "Static provisioning parent agent ID. See SPEC.md §4.2.",
      "pattern": "^agent://[a-z0-9.-]+/[a-z0-9._/-]+$",
      "maxLength": 255
    },
    "attestation": {
      "type": "object",
      "description": "How the org binds this name to a workload. See SPEC.md §4.3.",
      "required": ["method"],
      "properties": {
        "method": {
          "type": "string",
          "enum": ["none", "oidc", "spiffe-svid", "enclave-key", "mtls-cert", "dpop-key"]
        },
        "detail": {
          "type": "string",
          "description": "Method-specific reference, e.g. a SPIFFE ID or issuer URL."
        }
      },
      "additionalProperties": true
    },
    "filesystem": {
      "type": "array",
      "description": "Folders this agent is declared to access, each with a read or write mode. A declaration, not an enforced control. See SPEC.md §4.4.",
      "items": {
        "type": "object",
        "required": ["path", "mode"],
        "properties": {
          "path": {
            "type": "string",
            "minLength": 1,
            "description": "Folder path the agent is declared to access."
          },
          "mode": {
            "type": "string",
            "enum": ["read", "write"],
            "description": "Access mode for this folder."
          }
        },
        "additionalProperties": true
      }
    },
    "models": {
      "type": "array",
      "description": "LLM providers, models, and endpoints this agent is declared to use. A declaration for audit and inventory, not an enforced control. See SPEC.md §4.5.",
      "items": {
        "type": "object",
        "required": ["provider"],
        "properties": {
          "provider": {
            "type": "string",
            "minLength": 1,
            "description": "LLM provider label. SHOULD be one of the ids registered in SPEC.md 4.7 when one names the provider; stays an open string, and an unregistered value is legal. Ids are lowercase [a-z0-9-]."
          },
          "model": {
            "type": "string",
            "description": "Specific model this agent uses, when pinned, e.g. claude-sonnet-4-5 or gpt-4o."
          },
          "endpoint": {
            "type": "string",
            "description": "API endpoint host this agent is declared to reach, e.g. api.anthropic.com."
          }
        },
        "additionalProperties": true
      }
    },
    "labels": {
      "type": "object",
      "description": "Free-form key/value labels (e.g. env, cost_center). The \"version\" key is reserved by convention for the agent's own release version, not the passport schema version. See SPEC.md §4.6.",
      "additionalProperties": {
        "type": "string"
      }
    },
    "created_at": {
      "type": "string",
      "format": "date-time",
      "description": "RFC 3339 UTC timestamp."
    }
  },
  "additionalProperties": true
}
